{
  "schema_version": "1.0.0",
  "device_id": "device_alpha",
  "deployment_id": "ota_deployment_001",
  "status": "available",
  "current_version": "0.9.0",
  "target_version": "0.10.0",
  "update_available": true,
  "rollback_available": false,
  "progress_percent": 0,
  "checked_at": "2026-10-09T00:00:00Z",
  "release": {
    "schema_version": "1.0.0",
    "release_id": "ota_release_001",
    "firmware_version": "0.10.0",
    "hardware_revision": "s3_n16r8",
    "channel": "stable",
    "status": "published",
    "artifact_key": "0.10.0/stable/esp32_s3/firmware/sprout-firmware.bin",
    "artifact_url": "https://api.clarkhub.cn/releases/0.10.0/stable/esp32_s3/firmware/sprout-firmware.bin",
    "sha256": "bbbbbbbbbbbbbbbbbbbbbbbbbbbbbbbbbbbbbbbbbbbbbbbbbbbbbbbbbbbbbbbb",
    "size_bytes": 4194304,
    "signature_key_id": "ota_signing_001",
    "signature_algorithm": "ed25519",
    "signature": "AAAAAAAAAAAAAAAAAAAAAAAAAAAAAAAAAAAAAAAAAAAAAAAAAAAAAAAAAAAAAAAAAAAAAAAAAAAAAAAAAAAAAA==",
    "signature_status": "verified",
    "signature_verified_at": "2026-10-09T00:00:00Z",
    "rollback_allowed": true,
    "min_source_version": "0.9.0",
    "published_at": "2026-10-09T00:00:00Z",
    "canary_percent": 10,
    "target_type": "all",
    "target_id": "",
    "release_notes": "提升设备更新稳定性。",
    "created_at": "2026-10-08T00:00:00Z",
    "updated_at": "2026-10-09T00:00:00Z"
  }
}
